[
  {
    "recipe_id": "rec_001",
    "name": "Spicy Chicken Tacos",
    "ingredients": [
      {
        "quantity": 2.0,
        "unit": "cup",
        "item": "shredded chicken",
        "normalized_item": null,
        "original_text": "- 2 cups shredded chicken",
        "si_quantity": 473.176,
        "si_unit": "ml"
      },
      {
        "quantity": 1.0,
        "unit": "tbsp",
        "item": "taco seasoning",
        "normalized_item": null,
        "original_text": "- 1 tbsp taco seasoning",
        "si_quantity": 14.787,
        "si_unit": "ml"
      },
      {
        "quantity": 0.5,
        "unit": "cup",
        "item": "salsa",
        "normalized_item": null,
        "original_text": "- 0.5 cup salsa",
        "si_quantity": 118.294,
        "si_unit": "ml"
      },
      {
        "quantity": null,
        "unit": null,
        "item": "4 tortillas",
        "normalized_item": null,
        "original_text": "- 4 tortillas"
      }
    ],
    "instructions": [
      "Mix chicken and seasoning.",
      "Warm tortillas on a dry skillet for 30 seconds each side.",
      "Assemble tacos and top with salsa.",
      "Servings: 4"
    ],
    "prep_time_minutes": 15,
    "servings": 4,
    "tags": [
      "quick",
      "vegan-friendly",
      "vegetarian"
    ],
    "_meta": {
      "imputed_fields": [
        "servings"
      ],
      "original_values": {
        "servings": null
      },
      "parse_warnings": [
        "Servings not found in text."
      ],
      "is_duplicate": false,
      "duplicate_of": null
    }
  },
  {
    "recipe_id": "rec_002",
    "name": "Classic Pancakes",
    "ingredients": [
      {
        "quantity": 1.5,
        "unit": "cup",
        "item": "flour",
        "normalized_item": null,
        "original_text": "1.5 cups flour",
        "si_quantity": 354.882,
        "si_unit": "ml"
      },
      {
        "quantity": 2.0,
        "unit": "tbsp",
        "item": "sugar",
        "normalized_item": null,
        "original_text": "2 tbsp sugar",
        "si_quantity": 29.574,
        "si_unit": "ml"
      },
      {
        "quantity": 1.0,
        "unit": "cup",
        "item": "milk",
        "normalized_item": null,
        "original_text": "1 cup milk",
        "si_quantity": 236.588,
        "si_unit": "ml"
      },
      {
        "quantity": null,
        "unit": null,
        "item": "1 egg",
        "normalized_item": null,
        "original_text": "1 egg"
      }
    ],
    "instructions": [
      "Whisk dry ingredients together in a large bowl.",
      "Add wet ingredients and stir until just combined.",
      "Cook on a buttered skillet over medium heat until bubbles form, then flip."
    ],
    "prep_time_minutes": 20,
    "servings": 2,
    "tags": [
      "baking",
      "quick",
      "vegetarian"
    ],
    "_meta": {
      "imputed_fields": [],
      "original_values": {},
      "parse_warnings": [],
      "is_duplicate": false,
      "duplicate_of": null
    }
  },
  {
    "recipe_id": "rec_003",
    "name": "Quick Smoothie",
    "ingredients": [
      {
        "quantity": null,
        "unit": null,
        "item": "1 banana",
        "normalized_item": null,
        "original_text": "1 banana"
      },
      {
        "quantity": 1.0,
        "unit": "cup",
        "item": "milk",
        "normalized_item": null,
        "original_text": "1 cup milk",
        "si_quantity": 236.588,
        "si_unit": "ml"
      },
      {
        "quantity": 0.5,
        "unit": "cup",
        "item": "frozen berries",
        "normalized_item": null,
        "original_text": "1/2 cup frozen berries",
        "si_quantity": 118.294,
        "si_unit": "ml"
      }
    ],
    "instructions": [
      "Blend everything until smooth.",
      "Serve immediately."
    ],
    "prep_time_minutes": 5,
    "servings": 4,
    "tags": [
      "blended",
      "quick",
      "vegetarian"
    ],
    "_meta": {
      "imputed_fields": [
        "servings"
      ],
      "original_values": {
        "servings": null
      },
      "parse_warnings": [
        "Servings not found in text."
      ],
      "is_duplicate": false,
      "duplicate_of": null
    }
  },
  {
    "recipe_id": "rec_004",
    "name": "Garden Salad",
    "ingredients": [
      {
        "quantity": null,
        "unit": null,
        "item": "lettuce",
        "normalized_item": null,
        "original_text": "lettuce"
      },
      {
        "quantity": null,
        "unit": null,
        "item": "tomato",
        "normalized_item": null,
        "original_text": "tomato"
      },
      {
        "quantity": null,
        "unit": null,
        "item": "cucumber",
        "normalized_item": null,
        "original_text": "cucumber"
      },
      {
        "quantity": null,
        "unit": null,
        "item": "dressing",
        "normalized_item": null,
        "original_text": "dressing"
      }
    ],
    "instructions": [
      "Toss all leaves with dressing and serve chilled.",
      "Servings: 1"
    ],
    "prep_time_minutes": 22,
    "servings": 4,
    "tags": [
      "vegan-friendly",
      "vegetarian"
    ],
    "_meta": {
      "imputed_fields": [
        "prep_time_minutes",
        "servings"
      ],
      "original_values": {
        "prep_time_minutes": null,
        "servings": null
      },
      "parse_warnings": [
        "Prep time not found in text.",
        "Servings not found in text."
      ],
      "is_duplicate": false,
      "duplicate_of": null
    }
  },
  {
    "recipe_id": "rec_005",
    "name": "Beef Stew",
    "ingredients": [
      {
        "quantity": 1.0,
        "unit": "lb",
        "item": "beef chuck, cubed",
        "normalized_item": "beef chuck",
        "original_text": "• 1 lb beef chuck, cubed",
        "si_quantity": 453.592,
        "si_unit": "g"
      },
      {
        "quantity": 500.0,
        "unit": "g",
        "item": "potatoes, diced",
        "normalized_item": "potatoes",
        "original_text": "• 500 g potatoes, diced",
        "si_quantity": 500.0,
        "si_unit": "g"
      },
      {
        "quantity": 2.0,
        "unit": "cup",
        "item": "water",
        "normalized_item": null,
        "original_text": "• 2 cups water",
        "si_quantity": 473.176,
        "si_unit": "ml"
      },
      {
        "quantity": 1.0,
        "unit": "tbsp",
        "item": "olive oil",
        "normalized_item": "oil",
        "original_text": "• 1 tablespoon olive oil",
        "si_quantity": 14.787,
        "si_unit": "ml"
      }
    ],
    "instructions": [
      "Heat oil in a large pot.",
      "Brown the beef on all sides.",
      "Add potatoes and water.",
      "Bring to a boil.",
      "Reduce heat and simmer until tender."
    ],
    "prep_time_minutes": 120,
    "servings": 6,
    "tags": [
      "slow-cook",
      "vegan-friendly",
      "vegetarian"
    ],
    "_meta": {
      "imputed_fields": [],
      "original_values": {},
      "parse_warnings": [],
      "is_duplicate": false,
      "duplicate_of": null
    }
  },
  {
    "recipe_id": "rec_006",
    "name": "Margherita Pizza",
    "ingredients": [
      {
        "quantity": 2.0,
        "unit": "cup",
        "item": "all-purpose flour",
        "normalized_item": "flour",
        "original_text": "2 cups all-purpose flour",
        "si_quantity": 473.176,
        "si_unit": "ml"
      },
      {
        "quantity": 1.0,
        "unit": "tsp",
        "item": "dry yeast",
        "normalized_item": null,
        "original_text": "1 tsp dry yeast",
        "si_quantity": 4.929,
        "si_unit": "ml"
      },
      {
        "quantity": 0.75,
        "unit": "cup",
        "item": "warm water",
        "normalized_item": null,
        "original_text": "3/4 cup warm water",
        "si_quantity": 177.441,
        "si_unit": "ml"
      },
      {
        "quantity": 2.0,
        "unit": "tbsp",
        "item": "olive oil",
        "normalized_item": "oil",
        "original_text": "2 tbsp olive oil",
        "si_quantity": 29.574,
        "si_unit": "ml"
      },
      {
        "quantity": 1.0,
        "unit": "cup",
        "item": "tomato sauce",
        "normalized_item": null,
        "original_text": "1 cup tomato sauce",
        "si_quantity": 236.588,
        "si_unit": "ml"
      },
      {
        "quantity": 200.0,
        "unit": "g",
        "item": "mozzarella cheese",
        "normalized_item": null,
        "original_text": "200 g mozzarella cheese",
        "si_quantity": 200.0,
        "si_unit": "g"
      }
    ],
    "instructions": [
      "Combine flour, yeast, water and oil.",
      "Knead 10 minutes.",
      "Let dough rise 1 hour.",
      "Roll out and spread tomato sauce.",
      "Top with sliced mozzarella.",
      "Bake at 220C for 15 minutes until golden.",
      "Servings: 2"
    ],
    "prep_time_minutes": 90,
    "servings": 4,
    "tags": [
      "baking",
      "slow-cook",
      "vegan-friendly",
      "vegetarian"
    ],
    "_meta": {
      "imputed_fields": [
        "servings"
      ],
      "original_values": {
        "servings": null
      },
      "parse_warnings": [
        "Servings not found in text."
      ],
      "is_duplicate": false,
      "duplicate_of": null
    }
  },
  {
    "recipe_id": "rec_007",
    "name": "Chocolate Chip Cookies",
    "ingredients": [
      {
        "quantity": 2.25,
        "unit": "cup",
        "item": "flour",
        "normalized_item": null,
        "original_text": "2.25 cups flour",
        "si_quantity": 532.323,
        "si_unit": "ml"
      },
      {
        "quantity": 1.0,
        "unit": "tsp",
        "item": "baking soda",
        "normalized_item": null,
        "original_text": "1 tsp baking soda",
        "si_quantity": 4.929,
        "si_unit": "ml"
      },
      {
        "quantity": 1.0,
        "unit": "tsp",
        "item": "salt",
        "normalized_item": null,
        "original_text": "1 tsp salt",
        "si_quantity": 4.929,
        "si_unit": "ml"
      },